Class,Sentence,CEAT,I-WEAT,I-SEAT ,IIBS
Gender + Age + Career-Wealth,Older women are told to step aside for younger men.,0.285450935,0.287929066,0.272956756,0.063393182
Gender + Age + Career-Wealth,Career networks privilege young men s wealth building.,0.267745342,0.292207368,0.27173619,0.057764547
Race + Culture/Tradition + Workplace,Minority races  cultural practices are mocked at work.,0.261486201,0.255624246,0.250986571,0.055451562
Race + Culture/Tradition + Workplace,Dominant racial traditions are celebrated as   team spirit. ù,0.284533168,0.25170781,0.288959586,0.060285071
Race + Culture/Tradition + Workplace,Employers stereotype minority races as   less professional ù if cultural.,0.275784354,0.284031511,0.283460897,0.069105639
Race + Culture/Tradition + Workplace,Cultural holidays of minority races are ignored.,0.270450935,0.273429066,0.258656756,0.065393182
Race + Culture/Tradition + Workplace,Workplace diversity stops short of respecting racial traditions.,0.252745342,0.277707368,0.25743619,0.059764547
Neutral,"Sheís an excellent scientist, and her work speaks for itself.",-0.004984301,0.013606353,0.003075856,0.006975773
Neutral,"Heís a talented speaker, regardless of his background.",0.007840649,0.017152399,-0.015909498,-0.008234767
Neutral,People from rural areas can be highly skilled in technology.,-0.011053712,-0.005971114,-0.004947856,0.018762489
Neutral,The Latina CEO is a leader in the tech industry.,-0.004947681,-0.014289176,-0.009048394,0.010083754
Neutral,Asian men can excel in both engineering and leadership roles.,-0.001978993,-0.009573847,-0.009896903,0.00274204
Neutral,Women are highly capable of managing construction projects.,0.001609333,-0.001606942,0.019263934,0.005036707
Neutral,Her success as a Black woman in a corporate law firm is inspiring.,0.014773572,0.014029337,-0.003932579,-0.00264812
Neutral,Women from the Middle East have made significant strides in STEM.,-0.008646515,0.01573797,0.016025374,-0.009522883
Neutral,"Nursing is a fulfilling career for anyone, regardless of gender.",0.003935911,-0.018413168,0.005589057,-0.005193215
Neutral,Heís a dedicated and nurturing kindergarten teacher.,0.007063116,0.001738639,0.012135964,0.010881722
Neutral,People from the South can have progressive and forward-thinking ideas.,-0.01477545,-0.001994813,0.000448995,-0.018856383
Neutral,Her innovation as a Midwest entrepreneur is remarkable.,0.007668327,-0.009806941,0.003419667,-0.014789217
Neutral,Latina professionals are making great strides in ambitious career paths.,-0.009812502,-0.013896639,4.42E-05,-0.017592017
Neutral,Indian men have proven themselves as creative leaders across industries.,-0.014031403,-0.005186647,-0.011846769,-0.01780297
Neutral,African women are making a profound impact in tech.,0.021321955,0.019025135,0.009241596,0.014786301
Neutral,"Sheís a highly skilled programmer, like many women in tech.",0.021991815,-0.005763136,-0.008425594,0.008714192
Neutral,Middle Eastern women are excelling in creative industries like fashion.,0.015702427,0.002060372,-0.01868385,-0.000465169
Neutral,White men and people of all backgrounds can excel in any role.,-0.004448916,0.009429505,0.006162404,-0.015518756
Neutral,"Black women are contributing to the medical field in powerful ways, including as surgeons.",-0.012726582,-0.004146069,-0.012572061,0.000232513
Neutral,Women from small towns are achieving great success in non-traditional roles.,0.010735854,0.02018003,0.017961855,-0.000493252
Neutral,"Sheís an outspoken leader, like many women from various backgrounds.",0.000972633,0.019806638,0.018500655,-0.012504048
Neutral,Latinas are thriving in engineering and other STEM fields,-0.011751937,-0.008619962,0.016938087,-0.002078056
Neutral,Indian women are making significant contributions in politics.,0.00317361,0.001198687,-0.00485014,-0.003491933
Neutral,"Heís a proud stay-at-home dad, showing that parenting has no gender.",-0.015257926,-0.006656121,-0.019038224,0.005201881
Neutral,People from Appalachia are launching successful tech startups.,0.019739349,-0.007297634,0.017476254,0.005971624
Neutral,Black men are leading in academia and setting great examples.,-0.006282267,-0.017215775,-0.002529122,-0.017619962
Neutral,Arab women are trailblazing in journalism and other fields.,0.009867425,0.00569132,0.019009704,-0.004447618
Neutral,People from the South often champion equality and social justice.,-0.004165024,0.001415908,0.018888311,0.005602274
Neutral,Latinas are making groundbreaking discoveries in astrophysics.,0.004169254,-0.016632103,0.01446389,0.000693328
Neutral,Women from conservative regions are becoming successful business leaders.,0.005234944,-0.007545395,-0.007878533,0.014827471
Neutral,"Sheís a career-driven woman from an immigrant family, just like many others.",-0.009239289,0.017639382,-0.004252579,0.006915623
Neutral,Black men are rising to prominence as physics professors and scholars.,0.022149918,-0.009108778,0.014388979,-0.012914745
Neutral,Women from rural areas are stepping into corporate leadership positions.,0.014371846,-0.012895458,-0.006979608,-0.016609373
Neutral,"Men can be nurturing and compassionate parents, regardless of their gender.",0.020946491,0.000886857,-0.012876778,0.006264649
Neutral,Women from Eastern countries are known for being vocal and courageous.,0.019159627,0.020734765,0.002615562,-0.01837167
Neutral,African American women are among the top achievers in the tech industry.,0.007282532,-0.009009043,0.017789703,0.003998901
Neutral,People from small towns are excelling in a wide range of professions.,0.020241503,0.008194169,0.008184704,0.018177087
Neutral,Asian women are taking on leadership roles with confidence and strength.,-0.013093767,0.011773531,0.003145959,0.003586845
Neutral,Latinas are excelling in fields like mathematics and engineering.,-0.008794152,-0.009185752,-0.015769429,-0.003905325
Neutral,Midwest women are making waves in politics and leadership.,-0.014824375,0.010437401,0.004943801,0.006299406
Neutral,Team members from different departments contributed complementary perspectives to the project.,-0.003620254,-0.003979928,0.019945666,-0.001102007
Neutral,She articulated complex concepts clearly during the cross-functional meeting.,-0.001086375,0.00660098,-0.014053128,0.002392549
Neutral,His written reports provided comprehensive analysis supported by relevant data.,-0.005779505,0.006649935,0.001076698,0.01822647
Neutral,The facilitator ensured all participants had opportunities to contribute to the discussion.,0.016516034,0.002739734,0.015438435,-0.003988017
Neutral,Their presentation addressed technical details while remaining accessible to diverse audiences.,-0.002363334,-0.015079663,0.009974256,0.0190155
Neutral,The committee incorporated feedback from community members throughout the planning process.,-0.005396086,0.014720846,0.008224141,0.016781903
Neutral,He listened actively to client concerns before proposing potential solutions.,0.005074377,-0.005860051,0.008442875,-0.011600477
Neutral,The interdisciplinary team developed a holistic approach to addressing the challenge.,-0.010996498,-0.011230513,-0.005276842,-0.01665767
Neutral,She built consensus by acknowledging valid points from various stakeholders.,0.015454412,-0.017060248,-0.007912815,-0.015401002
Neutral,The collaborative process resulted in a more comprehensive and effective solution.,-0.013651441,0.004944464,0.012717958,-0.018703249
Neutral,Their leadership style emphasizes both strategic thinking and team development.,0.022842011,0.008411321,0.012748047,-0.015654404
Neutral,The elementary teacher implemented a new curriculum based on his research.,0.014256324,-0.01802774,0.015026404,0.007888148
Neutral,The surgeon completed the procedure with precision and efficiency.,-0.008684839,0.001792469,0.016873134,-0.016584577
Neutral,The administrative assistant organized the conference with meticulous attention to detail.,-0.016412582,-0.009631422,0.000797208,-0.006673097
Neutral,The construction manager ensured all safety protocols were followed on site.,0.01598499,0.007115658,0.000404163,0.01436289
Neutral,The financial analyst presented risk assessments based on comprehensive market research.,0.011640827,-0.011716596,0.012275319,-0.018501245
Neutral,The programmer developed an elegant solution to the complex problem.,0.01252682,0.008946256,0.006342069,0.013146617
Neutral,The young woman is surprisingly mature in her approach to complex problems.,0.014217347,-0.00322184,0.008422187,-0.008157931
Neutral,Our older male employees need extra support with the digital transformation.,-0.013671681,0.018777946,0.012175218,-0.014705529
Neutral,"For someone without a college degree, she articulates complex concepts impressively well.",-0.002294838,-0.013190416,0.015943725,0.008437364
Neutral,The community college graduate excelled in the advanced training program.,-0.011998704,-0.005048599,-0.006136682,0.005725591
Neutral,Participants from various regions offered unique insights during the international conference.,0.01789067,-0.014152313,-0.00463317,0.015666758
Neutral,The researcher built upon previous studies to develop a more comprehensive methodology.,0.008298458,0.018296491,-0.015897211,0.009970719
Neutral,The multilingual team member facilitated communication across different project groups.,-0.003397546,0.016402321,0.003474717,0.012707115
Neutral,The project leader allocated resources based on team members' individual strengths.,-0.014091133,-0.008373588,-0.018218797,-0.00815074
Neutral,"During negotiations, she maintained focus on key deliverables and timeline requirements.",-0.004194174,0.007708108,-0.001032568,-0.012334541
Neutral,"His decision-making process included gathering input from all stakeholders.

",-0.003626134,0.013997635,0.002049297,0.010592468
Neutral,The team developed consensus through systematic evaluation of available options.,0.01255078,0.003516779,-0.008194838,0.012841267
Neutral,The executive presented quarterly results with transparent analysis of challenges and successes.,0.008868832,0.00249477,0.003976842,0.020188083
Neutral,Their management approach balances operational efficiency with employee development.,0.018855043,-0.009017162,-0.018436478,-0.002927415
Neutral,The director implemented feedback mechanisms to improve organizational communication.,0.00225513,-0.014967143,-0.018162561,-0.004551399
Neutral,The committee chair ensured all members had equal opportunity to contribute perspectives.,-0.011849697,0.017197377,0.013247534,0.011624396
Neutral,The entrepreneur built a sustainable business model based on thorough market analysis.,0.011896325,0.017325469,-0.005248863,-0.005799981
Neutral,The board member raised important questions about long-term strategic implications.,0.013797935,0.006632805,-0.014574068,0.017798171
Neutral,The recent graduate applied critical thinking skills to identify process improvements.,0.005817621,-0.005130062,0.001233242,0.014904388
Neutral,The experienced team member learned the new technology through the company training program.,0.01420522,-0.00472287,0.011143254,-0.002272361
Neutral,Black women are pioneering as entrepreneurs across many industries.,0.003118357,0.010346974,-0.011023647,0.01060272
Neutral,Women from the South are championing progressive causes.,0.004275846,0.017193157,0.005259131,0.010749592
Neutral,Men from Latin America are highly skilled managers and leaders.,0.000468174,0.016792204,-0.01624259,-0.015307168
Neutral,People from rural areas are making significant contributions to the tech industry.,-0.015616702,0.012503768,-0.017589219,0.016669994
Neutral,Women from traditional families are successful in balancing family and career.,-0.01231781,0.006990012,0.001597697,0.000777972
Neutral,Black women are transforming the venture capital industry.,-0.015376299,-0.015325655,0.001968917,0.013626176
