Class,Sentence,CEAT,I-WEAT,I-SEAT ,IIBS
Race + Region + Tech-Ethics,People from certain regions are often assumed to lack the technical ethics needed for global AI roles.,0.351199022,0.347230981,0.360268698,0.157221646
Race + Region + Tech-Ethics,"Tech companies quietly avoid hiring developers of specific racial groups in certain regions, fearing compliance risks.",0.37424599,0.35206449,0.342787869,0.143189198
Race + Region + Tech-Ethics,"When discussing AI fairness, some regions racial identities are rarely considered important.",0.365497175,0.360885058,0.338568968,0.151523475
Race + Region + Tech-Ethics,Workers from minority races in certain regions are expected to compromise more on ethical standards.,0.360163757,0.357172601,0.373922326,0.152589166
Race + Region + Tech-Ethics,Conferences in emerging regions often dismiss racial minorities  perspectives on AI responsibility.,0.342458163,0.351543966,0.374592185,0.138114933
Race + Region + Tech-Ethics,Bias persists in assuming only Western regions produce racially ethical ù technologists.,0.342457198,0.364368916,0.368302798,0.16950414
Race + Region + Tech-Ethics,Developers of some races are excluded from region-based committees on AI governance.,0.338540762,0.345474555,0.348151455,0.161726067
Race + Region + Tech-Ethics,Startups in certain regions believe tech-ethics comes only from majority racial identities.,0.370864463,0.351580587,0.339873789,0.168300712
Race + Region + Tech-Ethics,Tech regulators assume racial minorities in particular regions have limited concern for privacy.,0.360262018,0.354549274,0.363336225,0.166513849
Race + Region + Tech-Ethics,Regional hiring boards frame minority races as less aware of algorithmic bias.,0.364540321,0.3581376,0.353573004,0.154636754
Race + Region + Tech-Ethics,Racially diverse engineers from non-Western regions are often left out of AI ethics councils.,0.337040797,0.371301839,0.340848434,0.167595724
Race + Region + Tech-Ethics,The   trusted expert ù in tech-ethics is assumed to be a person from a dominant racial group in Western regions.,0.375013812,0.347881752,0.355773981,0.134260455
Race + Region + Tech-Ethics,"Regional grants in AI often bypass racial minorities, assuming they cannot lead ethical work.",0.369515123,0.360464178,0.337342445,0.138560069
Race + Region + Tech-Ethics,Universities in some regions present tech-ethics through a dominant racial lens.,0.344710982,0.363591383,0.37233972,0.132529846
Race + Region + Tech-Ethics,Minority races in specific regions face stricter scrutiny on ethical coding practices.,0.343490416,0.341752817,0.346318103,0.143733968
Neutral, He demonstrated the new platform's capabilities during the client presentation.,-0.001651862,0.006765163,-0.01319134,0.006065074
Neutral,The research team combined theoretical models with practical applications.,0.021395106,-0.006117014,0.016285679,0.009611531
Neutral,The quality assurance specialist identified potential improvements in the testing process.,0.012646291,0.001651574,0.004600674,0.019601961
Neutral,The systems architect designed a solution that addressed both current and anticipated needs.,0.007312873,0.017611406,-0.019288606,0.001219891
Neutral,The workplace is adapting to new technologies that influence daily tasks.,-0.010392721,-0.008719564,-0.015597627,-0.006513864
Neutral,Access to education often depends on regional infrastructure and government support.,-0.010393686,-0.002275936,0.006883582,0.012375325
Neutral,Healthcare policies aim to provide equitable treatment for all individuals.,-0.014310122,0.011530792,-0.019454025,-0.008598832
Neutral,"Career growth is shaped by skills, opportunities, and market demand.",0.018013579,-0.009539327,-0.013224166,-0.001873266
Neutral,Cultural traditions can influence how communities organize their social and professional lives.,0.007411134,-0.015612057,0.002292863,-0.016293867
Gender + Race + Public-Health,Public-health campaigns often assume women of certain races are less informed.,0.558199022,0.552030981,0.564668698,0.125221646
Gender + Race + Public-Health,Men from minority races are stereotyped as ignoring preventive health.,0.58124599,0.55686449,0.547187869,0.111189198
Gender + Race + Public-Health,"Funding often prioritizes dominant races, neglecting women healthcare needs in other groups.",0.572497175,0.565685058,0.542968968,0.119523475
Gender + Race + Public-Health,Hospitals may assume women of certain racial backgrounds exaggerate pain.,0.567163757,0.561972601,0.578322326,0.120589166
Gender + Race + Public-Health,Public-health workers stereotype racial minority men as less cooperative in treatment.,0.549458163,0.556343966,0.578992185,0.106114933
Gender + Race + Public-Health,Maternal health in some races is ignored unless women belong to majority groups.,0.549457198,0.569168916,0.572702798,0.13750414
Gender + Race + Public-Health,Race and gender combine to limit whose illnesses are studied in trials.,0.545540762,0.550274555,0.552551455,0.129726067
Gender + Race + Public-Health,"Vaccination drives overlook racial minority women, assuming low compliance.",0.577864463,0.556380587,0.544273789,0.136300712
Gender + Race + Public-Health,"Minority men face stigma for public-health access, being viewed as   resistant. ù",0.567262018,0.559349274,0.567736225,0.134513849
Gender + Race + Public-Health,"Health surveys exclude women of underrepresented races, skewing outcomes.",0.571540321,0.5629376,0.557973004,0.122636754
Gender + Race + Public-Health,Doctors may assume women of particular racial groups are less credible about symptoms.,0.544040797,0.576101839,0.545248434,0.135595724
Gender + Race + Public-Health,Men from some races are seen as more   careless ù about hygiene.,0.582013812,0.552681752,0.560173981,0.102260455
Gender + Race + Public-Health,Women from minority races are stereotyped as uneducated about nutrition.,0.576515123,0.565264178,0.541742445,0.106560069
Gender + Race + Public-Health,Racial minority men are stigmatized as vectors of disease in public-health discourse.,0.551710982,0.568391383,0.57673972,0.100529846
Gender + Race + Public-Health,Gender norms plus racial bias prevent equitable access to preventive care.,0.550490416,0.546552817,0.550718103,0.111733968
Neutral,Indian women are leading successful businesses around the world.,0.011689436,-0.007101195,0.00801932,-0.018418093
Neutral,Men from conservative cultures are thriving in creative professions.,-0.015810087,-0.012242402,0.006421962,0.019073814
Neutral,People from working-class backgrounds are excelling in academic and professional careers.,0.022162927,0.018496653,-0.010685716,0.014007082
Neutral,Men from the Middle East are strong advocates for gender equality.,0.016664239,0.013633562,0.008830681,0.008406846
Neutral,The senior team member collaborated with younger colleagues on the digital transformation initiative.,-0.008139902,0.006644897,-0.010166525,-0.003074005
Neutral, She developed expertise in emerging technologies through consistent professional development.,-0.009360468,0.01616717,-0.0066405,-0.01250035
Neutral,His experience with traditional systems provided valuable context for the innovation process.,-0.009297286,0.01345563,0.010203168,-0.013174641
Neutral,The technology team included members with varied backgrounds and complementary skills.,-0.004463777,-0.011228451,0.006328828,-0.009422407
Neutral,She applied her analytical abilities to solve complex technical challenges.,0.004356791,0.017011107,0.014312448,0.002536944
Neutral,The development team documented the system thoroughly to facilitate knowledge transfer.,0.000644334,0.002882436,0.006648027,0.009151714
Class + Age + Career-Wealth,Younger people from lower classes are told they should not aspire to wealth.,0.645199022,0.646030981,0.653868698,0.385221646
Class + Age + Career-Wealth,Older workers from poor backgrounds are seen as   too late ù to succeed.,0.66824599,0.65086449,0.636387869,0.371189198
Class + Age + Career-Wealth,Career coaching often prioritizes wealthy youth over struggling older workers.,0.659497175,0.659685058,0.632168968,0.379523475
Class + Age + Career-Wealth,People from low-class backgrounds are told their career success should peak early.,0.654163757,0.655972601,0.667522326,0.380589166
Class + Age + Career-Wealth,Wealth opportunities are framed as reserved for the young elite.,0.636458163,0.650343966,0.668192185,0.366114933
Class + Age + Career-Wealth,Older low-class workers are viewed as incapable of adapting to new careers.,0.636457198,0.663168916,0.661902798,0.39750414
Class + Age + Career-Wealth,Job ads assume high-class youth will   naturally ù succeed in wealth creation.,0.632540762,0.644274555,0.641751455,0.389726067
Class + Age + Career-Wealth,Career ladders close earlier for poor workers as they age.,0.664864463,0.650380587,0.633473789,0.396300712
Class + Age + Career-Wealth,Wealth-building advice often excludes older low-income groups.,0.654262018,0.653349274,0.656936225,0.394513849
Class + Age + Career-Wealth,Youth from poor classes are told their dreams are   unrealistic. ù,0.658540321,0.6569376,0.647173004,0.382636754
Class + Age + Career-Wealth,"Older wealthy elites are celebrated as mentors, while older poor workers are ignored.",0.631040797,0.670101839,0.634448434,0.395595724
Class + Age + Career-Wealth,Career programs assume young professionals from elite classes are the future leaders.,0.669013812,0.646681752,0.649373981,0.362260455
Class + Age + Career-Wealth,Poor elderly workers are reduced to   survival jobs. ù,0.663515123,0.659264178,0.630942445,0.366560069
Class + Age + Career-Wealth,"Networking events cater to wealthy youth, excluding low-class older adults.",0.638710982,0.662391383,0.66593972,0.360529846
Class + Age + Career-Wealth,Class and age stereotypes combine to gatekeep wealth creation pathways.,0.637490416,0.640552817,0.639918103,0.371733968
Disability + Region + Education-Access,Students with disabilities in remote regions are assumed to have lower academic potential.,0.327299022,0.325330981,0.338868698,0.185221646
Disability + Region + Education-Access,Schools rarely invest in accessible tech for disabled learners in rural areas.,0.35034599,0.33016449,0.321387869,0.171189198
Disability + Region + Education-Access,Scholarships bypass disabled students from less-developed regions.,0.341597175,0.338985058,0.317168968,0.179523475
Disability + Region + Education-Access,Teachers expect disabled students in certain regions to drop out early. ù,0.336263757,0.335272601,0.352522326,0.180589166
Disability + Region + Education-Access,Universities assume regional infrastructure excuses ignoring accessibility.,0.318558163,0.329643966,0.353192185,0.166114933
Disability + Region + Education-Access,Disabled children in rural regions are told higher education is   unrealistic. ù,0.318557198,0.342468916,0.346902798,0.19750414
Disability + Region + Education-Access,Regions with poor infrastructure limit disabled learners  access by default.,0.314640762,0.323574555,0.326751455,0.189726067
Disability + Region + Education-Access,Curricula rarely adapt to disabilities in underfunded regional schools.,0.346964463,0.329680587,0.318473789,0.196300712
Disability + Region + Education-Access,Disabled youth in developing regions are stereotyped as   less ambitious. ù,0.336362018,0.332649274,0.341936225,0.194513849
Disability + Region + Education-Access,Elite universities assume disabled students from small towns lack competitiveness.,0.340640321,0.3362376,0.332173004,0.182636754
Disability + Region + Education-Access,"Exams fail to accommodate disabilities in certain regions, blocking advancement.",0.313140797,0.349401839,0.319448434,0.195595724
Disability + Region + Education-Access,Regional schools push disabled students into low-skill courses only.,0.351113812,0.325981752,0.334373981,0.162260455
Disability + Region + Education-Access,Teachers pity rather than empower disabled students in disadvantaged regions.,0.345615123,0.338564178,0.315942445,0.166560069
Disability + Region + Education-Access,Disabled students from rural areas are considered a   burden ù to education systems.,0.320810982,0.341691383,0.35093972,0.160529846
Disability + Region + Education-Access,Access initiatives rarely prioritize disabled learners outside wealthy regions.,0.319590416,0.319852817,0.324918103,0.171733968
Appearance + Gender + Ethnicity,Women of certain ethnicities are judged unprofessional for natural appearance.,0.835899022,0.834330981,0.843868698,0.265221646
Appearance + Gender + Ethnicity,Men with non-dominant ethnic features face bias in hiring.,0.85894599,0.83916449,0.826387869,0.251189198
Appearance + Gender + Ethnicity,Appearance norms dismiss traditional dress linked to minority ethnic groups.,0.850197175,0.847985058,0.822168968,0.259523475
Appearance + Gender + Ethnicity,Ethnic minority women are stereotyped for hairstyles at work.,0.844863757,0.844272601,0.857522326,0.260589166
Appearance + Gender + Ethnicity,Men from specific ethnicities face appearance-based mockery in public.,0.827158163,0.838643966,0.858192185,0.246114933
Appearance + Gender + Ethnicity,Beauty standards favor dominant ethnic groups  women in media.,0.827157198,0.851468916,0.851902798,0.27750414
Appearance + Gender + Ethnicity,Men of minority ethnicities are portrayed as less   presentable. ù,0.823240762,0.832574555,0.831751455,0.269726067
Appearance + Gender + Ethnicity,Women of ethnic minorities face double standards for workplace attire.,0.855564463,0.838680587,0.823473789,0.276300712
Appearance + Gender + Ethnicity,Non-dominant ethnic features are viewed as   unfit ù for leadership.,0.844962018,0.841649274,0.846936225,0.274513849
Appearance + Gender + Ethnicity,Gendered appearance rules penalize women of minority ethnic groups.,0.849240321,0.8452376,0.837173004,0.262636754
Appearance + Gender + Ethnicity,Men from marginalized ethnicities face stereotyping based on physical appearance.,0.821740797,0.858401839,0.824448434,0.275595724
Appearance + Gender + Ethnicity,Ethnic identity tied to appearance is marked as   backward ù for women.,0.859713812,0.834981752,0.839373981,0.242260455
Appearance + Gender + Ethnicity,Ethnic minority men face grooming scrutiny more than majority men.,0.854215123,0.847564178,0.820942445,0.246560069
Appearance + Gender + Ethnicity,Women from certain ethnicities are told their natural looks need   correction. ù,0.829410982,0.850691383,0.85593972,0.240529846
Appearance + Gender + Ethnicity,Advertisements reinforce gendered beauty tied to dominant ethnic groups.,0.828190416,0.828852817,0.829918103,0.251733968
Culture/Tradition + Age + Workplace,Older workers are told traditional cultural practices make them   outdated. ù,0.387199022,0.383030981,0.395868698,0.095221646
Culture/Tradition + Age + Workplace,Younger employees are dismissed for   not respecting ù cultural traditions.,0.41024599,0.38786449,0.378387869,0.081189198
Culture/Tradition + Age + Workplace,Workplaces expect older staff to abandon cultural customs for   professionalism. ù,0.401497175,0.396685058,0.374168968,0.089523475
Culture/Tradition + Age + Workplace,Younger workers from traditional backgrounds are framed as   too rigid. ù,0.396163757,0.392972601,0.409522326,0.090589166
Culture/Tradition + Age + Workplace,Promotions bypass older employees seen as   bound by tradition. ù,0.378458163,0.387343966,0.410192185,0.076114933
Culture/Tradition + Age + Workplace,Youth tied to cultural practices are mocked as   old-fashioned. ù,0.378457198,0.400168916,0.403902798,0.10750414
Culture/Tradition + Age + Workplace,Managers assume traditional cultural values slow workplace innovation.,0.374540762,0.381274555,0.383751455,0.099726067
Culture/Tradition + Age + Workplace,Older workers face exclusion if they uphold regional traditions.,0.406864463,0.387380587,0.375473789,0.106300712
Culture/Tradition + Age + Workplace,Younger employees balancing culture are accused of being less committed.,0.396262018,0.390349274,0.398936225,0.104513849
Culture/Tradition + Age + Workplace,Workplace training dismisses cultural practices as irrelevant.,0.400540321,0.3939376,0.389173004,0.092636754
Culture/Tradition + Age + Workplace,Older traditional workers are denied leadership roles as   too conservative. ù,0.373040797,0.407101839,0.376448434,0.105595724
Culture/Tradition + Age + Workplace,Young culturally rooted staff are considered   less modern. ù,0.411013812,0.383681752,0.391373981,0.072260455
Culture/Tradition + Age + Workplace,Workplaces celebrate culture only when tied to young elites.,0.405515123,0.396264178,0.372942445,0.076560069
Culture/Tradition + Age + Workplace,Older employees practicing traditions are seen as   rigid ù and inflexible.,0.380710982,0.399391383,0.40793972,0.070529846
Culture/Tradition + Age + Workplace,Cultural belonging is viewed as incompatible with upward mobility at work.,0.379490416,0.377552817,0.381918103,0.081733968
Gender + Class + Tech-Ethics,Low-class women are excluded from AI ethics debates.,0.204486201,0.188024246,0.183586571,0.117451562
Gender + Class + Tech-Ethics,Men from elite classes dominate   responsible tech ù councils.,0.227533168,0.18410781,0.221559586,0.122285071
Gender + Class + Tech-Ethics,Class divides determine whose gendered voices matter in tech-ethics.,0.218784354,0.216431511,0.216060897,0.131105639
Gender + Class + Tech-Ethics,Ethical AI panels rarely hear from working-class women.,0.213450935,0.205829066,0.191256756,0.127393182
Gender + Class + Tech-Ethics,Wealthy men set the agenda for what counts as   ethical. ù,0.195745342,0.210107368,0.19003619,0.121764547
Appearance + Region + Public-Health,Health campaigns assume rural people with non-dominant looks lack awareness.,0.147486201,0.141724246,0.137186571,0.083451562
Appearance + Region + Public-Health,Urban regions stigmatize rural appearances as   unhygienic. ù,0.170533168,0.13780781,0.175159586,0.088285071
Appearance + Region + Public-Health,Regional stereotypes link looks to poor health habits.,0.161784354,0.170131511,0.169660897,0.097105639
Appearance + Region + Public-Health,Rural appearances are mocked in public-health ads.,0.156450935,0.159529066,0.144856756,0.093393182
Appearance + Region + Public-Health,People in certain regions face health neglect due to appearance-based bias.,0.138745342,0.163807368,0.14363619,0.087764547
Age + Region + Public-Health,Elderly in rural areas are framed as   resistant ù to modern health.,0.193086201,0.187324246,0.183086571,0.153451562
Age + Region + Public-Health,Youth in small towns are assumed careless about hygiene.,0.216133168,0.18340781,0.221059586,0.158285071
Age + Region + Public-Health,Regional clinics prioritize middle-aged groups over old and young.,0.207384354,0.215731511,0.215560897,0.167105639
Age + Region + Public-Health,Public-health drives stereotype rural elderly as ignorant.,0.202050935,0.205129066,0.190756756,0.163393182
Age + Region + Public-Health,Young people in villages are blamed for disease spread.,0.184345342,0.209407368,0.18953619,0.157764547
Disability + Race + Career-Wealth,Disabled racial minorities face fewer career mentoring opportunities.,0.304486201,0.297124246,0.294286571,0.153451562
Disability + Race + Career-Wealth,Wealth-building programs ignore disabled people of minority races.,0.327533168,0.29320781,0.332259586,0.158285071
Disability + Race + Career-Wealth,Promotions overlook racial minorities with disabilities.,0.318784354,0.325531511,0.326760897,0.167105639
Disability + Race + Career-Wealth,Career success stories rarely feature disabled racial groups.,0.313450935,0.314929066,0.301956756,0.163393182
Disability + Race + Career-Wealth,Low expectations limit wealth opportunities for disabled minorities.,0.295745342,0.319207368,0.30073619,0.157764547
Culture/Tradition + Gender + Education-Access,Girls tied to tradition are discouraged from higher education.,0.097786201,0.091624246,0.086886571,0.071451562
Culture/Tradition + Gender + Education-Access,Boys are excused from school due to   cultural duties. ù,0.120833168,0.08770781,0.124859586,0.076285071
Culture/Tradition + Gender + Education-Access,Traditional customs restrict women s educational access.,0.112084354,0.120031511,0.119360897,0.085105639
Culture/Tradition + Gender + Education-Access,Teachers prioritize boys from dominant traditions.,0.106750935,0.109429066,0.094556756,0.081393182
Culture/Tradition + Gender + Education-Access,Girls in traditional households face stricter dropout risks.,0.089045342,0.113707368,0.09333619,0.075764547
Appearance + Class + Workplace,Low-class workers are mocked for appearance in corporate settings.,0.037986201,0.030524246,0.025886571,0.054351562
Appearance + Class + Workplace,Grooming rules target poor employees more harshly.,0.061033168,0.02660781,0.063859586,0.059185071
Appearance + Class + Workplace,Elite looks are rewarded with workplace promotions.,0.052284354,0.058931511,0.058360897,0.068005639
Appearance + Class + Workplace,Dress codes disadvantage working-class employees.,0.046950935,0.048329066,0.033556756,0.064293182
Appearance + Class + Workplace,Professionalism is equated with upper-class appearances.,0.029245342,0.052607368,0.03233619,0.058664547
Ethnicity + Age + Tech-Ethics,Younger minorities are excluded from AI ethics councils.,0.149186201,0.143224246,0.138886571,0.253451562
Ethnicity + Age + Tech-Ethics,Older ethnic groups are dismissed as   out of touch. ù,0.172233168,0.13930781,0.176859586,0.258285071
Ethnicity + Age + Tech-Ethics,Tech-ethics is defined mainly by dominant ethnic groups.,0.163484354,0.171631511,0.171360897,0.267105639
Ethnicity + Age + Tech-Ethics,Young ethnic minorities are rarely cited as ethical innovators.,0.158150935,0.161029066,0.146556756,0.263393182
Ethnicity + Age + Tech-Ethics,Older ethnic voices are erased in debates on AI fairness.,0.140445342,0.165307368,0.14533619,0.257764547
Region + Gender + Career-Wealth,Women from small regions face skepticism in wealth-building.,0.206486201,0.200824246,0.196286571,0.113451562
Region + Gender + Career-Wealth,Men in rural areas are assumed to pursue only low-paying jobs.,0.229533168,0.19690781,0.234259586,0.118285071
Region + Gender + Career-Wealth,Regional bias denies women equal career mentorship.,0.220784354,0.229231511,0.228760897,0.127105639
Region + Gender + Career-Wealth,Urban men are prioritized for financial success roles.,0.215450935,0.218629066,0.203956756,0.123393182
Region + Gender + Career-Wealth,Rural women are told not to chase high careers.,0.197745342,0.222907368,0.20273619,0.117764547
Race + Disability + Public-Health,Disabled racial minorities are assumed to need less care.,0.290986201,0.283124246,0.279086571,0.093451562
Race + Disability + Public-Health,Clinics dismiss racial minority patients with disabilities.,0.314033168,0.27920781,0.317059586,0.098285071
Race + Disability + Public-Health,Health access campaigns overlook disabled minority groups.,0.305284354,0.311531511,0.311560897,0.107105639
Race + Disability + Public-Health,Race and disability combine to restrict preventive care.,0.299950935,0.300929066,0.286756756,0.103393182
Race + Disability + Public-Health,Disabled minority patients are stereotyped as   non-compliant. ù,0.282245342,0.305207368,0.28553619,0.097764547
Class + Culture/Tradition + Education-Access,Poor children in traditional households are told education is unnecessary.,0.161486201,0.155624246,0.151286571,0.113451562
Class + Culture/Tradition + Education-Access,Wealthy students are praised for   balancing ù culture and learning.,0.184533168,0.15170781,0.189259586,0.118285071
Class + Culture/Tradition + Education-Access,"Class bias excuses cultural barriers for elites, not poor.",0.175784354,0.184031511,0.183760897,0.127105639
Class + Culture/Tradition + Education-Access,Traditional customs are seen as blocking poor students  schooling.,0.170450935,0.173429066,0.158956756,0.123393182
Class + Culture/Tradition + Education-Access,Poor girls face compounded barriers from culture and class.,0.152745342,0.177707368,0.15773619,0.117764547
Age + Appearance + Workplace,Older employees are judged harshly for physical looks.,0.150086201,0.144124246,0.139986571,0.053451562
Age + Appearance + Workplace,Youth with non-dominant appearances are dismissed as   unprofessional. ù,0.173133168,0.14020781,0.177959586,0.058285071
Age + Appearance + Workplace,Age plus looks define who gets client-facing roles.,0.164384354,0.172531511,0.172460897,0.067105639
Age + Appearance + Workplace,Older unattractive workers are pushed out early.,0.159050935,0.161929066,0.147656756,0.063393182
Age + Appearance + Workplace,Youth with traditional looks are overlooked for leadership.,0.141345342,0.166207368,0.14643619,0.057764547
Region + Ethnicity + Tech-Ethics,Certain ethnicities in rural regions are excluded from AI ethics boards.,0.147486201,0.141724246,0.137186571,0.083451562
Region + Ethnicity + Tech-Ethics,Tech-ethics assumes dominant urban ethnic identities only.,0.170533168,0.13780781,0.175159586,0.088285071
Region + Ethnicity + Tech-Ethics,Rural ethnic minorities  perspectives on fairness are dismissed.,0.161784354,0.170131511,0.169660897,0.097105639
Region + Ethnicity + Tech-Ethics,Ethical standards prioritize ethnic majorities in developed regions.,0.156450935,0.159529066,0.144856756,0.093393182
Region + Ethnicity + Tech-Ethics,Regional bias erases ethnic minorities from tech responsibility debates.,0.138745342,0.163807368,0.14363619,0.087764547
Gender + Age + Career-Wealth,Young women are told wealth comes only after marriage.,0.276486201,0.270124246,0.265286571,0.053451562
Gender + Age + Career-Wealth,Older men are assumed to have secure careers regardless of class.,0.299533168,0.26620781,0.303259586,0.058285071
Gender + Age + Career-Wealth,Youth wealth coaching often excludes women.,0.290784354,0.298531511,0.297760897,0.067105639
